<?xml version="1.0" encoding="UTF-8"?>
<Zahtev_za_priznanje_patenta xmlns="http://www.ftn.uns.ac.rs/patent"
    xmlns:xsi="http://www.w3.org/2001/XMLSchema-instance"
    xsi:schemaLocation="http://www.ftn.uns.ac.rs/patent file:/C:/Users/Korisnik/Desktop/FAKS/XML/Projekat/P_Sema.xsd">
    <Osnovne_informacije_o_zahtevu_za_priznanje_patenta>
        <Broj_prijave></Broj_prijave>
        <Datum_prijema>2020-01-01</Datum_prijema>
        <Priznati_datum_podnosenja>2020-01-01</Priznati_datum_podnosenja>
    </Osnovne_informacije_o_zahtevu_za_priznanje_patenta>
    <Sadrzaj_zahteva_za_priznanje_patenta>
        <Naziv_pronalaska/>
        <Naziv_pronalaska/>
        <Podaci_o_podnosiocu_prijave>
            <Podnosilac_prijave_je_i_pronalazac>true</Podnosilac_prijave_je_i_pronalazac>
            <Podnosilac_prijave>
                <Osnovni_podaci_o_licu>
                    <Adresa_lica>
                        <Ulica></Ulica>
                        <Broj_u_ulici>3</Broj_u_ulici>
                        <Postanski_broj>21000</Postanski_broj>
                        <Mesto></Mesto>
                        <Drzava></Drzava>
                    </Adresa_lica>
                    <Broj_telefona></Broj_telefona>
                    <Broj_faksa></Broj_faksa>
                    <E_posta></E_posta>
                </Osnovni_podaci_o_licu>
            </Podnosilac_prijave>
        </Podaci_o_podnosiocu_prijave>
        <Podaci_o_pronalazacu>
            <Pronalazac>
                <Osnovni_podaci_o_licu>
                    <Adresa_lica>
                        <Ulica></Ulica>
                        <Broj_u_ulici>5</Broj_u_ulici>
                        <Postanski_broj>11000</Postanski_broj>
                        <Mesto></Mesto>
                        <Drzava></Drzava>
                    </Adresa_lica>
                    <Broj_telefona></Broj_telefona>
                    <Broj_faksa></Broj_faksa>
                    <E_posta></E_posta>
                </Osnovni_podaci_o_licu>
                <Ime></Ime>
                <Prezime></Prezime>
                <Drzavljanstvo></Drzavljanstvo>
            </Pronalazac>
            <Osnovni_podaci_o_licu>
                <Adresa_lica>
                    <Ulica></Ulica>
                    <Broj_u_ulici>7</Broj_u_ulici>
                    <Postanski_broj>21000</Postanski_broj>
                    <Mesto></Mesto>
                    <Drzava></Drzava>
                </Adresa_lica>
                <Broj_telefona></Broj_telefona>
                <Broj_faksa></Broj_faksa>
                <E_posta></E_posta>
            </Osnovni_podaci_o_licu>
        </Podaci_o_pronalazacu>
        <Podaci_o_punomocniku>
            <Vrsta_punomocnika>PUNOMOCNIK_ZA_ZASTUPANJE</Vrsta_punomocnika>
            <Zajednicki_predstavnik>false</Zajednicki_predstavnik>
            <Punomocnik>
                <Osnovni_podaci_o_licu>
                    <Adresa_lica>
                        <Ulica></Ulica>
                        <Broj_u_ulici>1</Broj_u_ulici>
                        <Postanski_broj>21000</Postanski_broj>
                        <Mesto></Mesto>
                        <Drzava></Drzava>
                    </Adresa_lica>
                    <Broj_telefona></Broj_telefona>
                    <Broj_faksa></Broj_faksa>
                    <E_posta></E_posta>
                </Osnovni_podaci_o_licu>
            </Punomocnik>
        </Podaci_o_punomocniku>
        <Dostavljanje>
            <Adresa_za_dostavljanje>
                <Ulica></Ulica>
                <Broj_u_ulici>1</Broj_u_ulici>
                <Postanski_broj>21000</Postanski_broj>
                <Mesto></Mesto>
                <Drzava></Drzava>
            </Adresa_za_dostavljanje>
            <Nacin_dostave>ELEKTRONSKIM_PUTEM</Nacin_dostave>
        </Dostavljanje>
        <Podaci_o_prijavi>
            <Vrsta_prijave>IZDVOJENA</Vrsta_prijave>
            <Broj_osnovne_prijave></Broj_osnovne_prijave>
            <Datum_podnosenja_prijave>2020-01-01</Datum_podnosenja_prijave>
        </Podaci_o_prijavi>
        <Zahtev_za_priznanje_prvenstva_iz_ranijih_prijava></Zahtev_za_priznanje_prvenstva_iz_ranijih_prijava>
    </Sadrzaj_zahteva_za_priznanje_patenta>
</Zahtev_za_priznanje_patenta>